### ISSUE TITLE
immem_capture send packet one by one,  the  ack number failed compute normal

### ISSUE THREAD

**Issue by jiamo** [KimiNewt/pyshark#71]
```
import pcap
import pyshark
import os

def test():
    pcapfile = os.path.abspath("/home/engine/pcap/dshell/good.pcap")
    pcap_capture = pcap.pcap(pcapfile)
    immem_capture = pyshark.InMemCapture()
    count = 0

    try:
        while True:
            count += 1
            packet = pcap_capture.next()
            if packet is None:
                break
            ts ,packet_data = packet
            tshark_pkt = immem_capture.feed_packet(packet_data)
            seq = tshark_pkt[2].seq

            print("packet count %d seq is %s " %(count, seq ))

    except Exception as e:
        print e

if __name__ == "__main__":

    test()
```
## using thark  the seq number is right

> engine@engine:~$ tshark -r ~/pcap/dshell/good.pcap 
> 1   0.000000 2001:6f8:102d:0:2d0:9ff:fee3:e8de -> 2001:6f8:900:7c0::2 TCP 94 59201→80 [SYN] Seq=0 Win=5760 Len=0 MSS=1440 SACK_PERM=1 TSval=664232 TSecr=0 WS=32
> 2   0.000086 2001:6f8:900:7c0::2 -> 2001:6f8:102d:0:2d0:9ff:fee3:e8de TCP 82 80→59201 [SYN, ACK] Seq=0 Ack=1 Win=65535 Len=0 MSS=1432 SACK_PERM=1
> 3   0.000374 2001:6f8:102d:0:2d0:9ff:fee3:e8de -> 2001:6f8:900:7c0::2 TCP 74 59201→80 [ACK] Seq=1 Ack=1 Win=184320 Len=0
> 4   0.009619 2001:6f8:102d:0:2d0:9ff:fee3:e8de -> 2001:6f8:900:7c0::2 HTTP 314 GET / HTTP/1.0 
> 5   0.014704 2001:6f8:900:7c0::2 -> 2001:6f8:102d:0:2d0:9ff:fee3:e8de TCP 1506 [TCP segment of a reassembled PDU]
> 6   0.014733 2001:6f8:900:7c0::2 -> 2001:6f8:102d:0:2d0:9ff:fee3:e8de HTTP 901 HTTP/1.1 200 OK  (text/html)
> 7   0.014835 2001:6f8:900:7c0::2 -> 2001:6f8:102d:0:2d0:9ff:fee3:e8de TCP 74 80→59201 [FIN, ACK] Seq=2260 Ack=241 Win=65535 Len=0
> 8   0.015366 2001:6f8:102d:0:2d0:9ff:fee3:e8de -> 2001:6f8:900:7c0::2 TCP 74 59201→80 [ACK] Seq=241 Ack=1433 Win=274944 Len=0
> 9   0.015371 2001:6f8:102d:0:2d0:9ff:fee3:e8de -> 2001:6f8:900:7c0::2 TCP 74 59201→80 [ACK] Seq=241 Ack=2260 Win=366592 Len=0
> 10   0.029609 2001:6f8:102d:0:2d0:9ff:fee3:e8de -> 2001:6f8:900:7c0::2 TCP 74 59201→80 [FIN, ACK] Seq=241 Ack=2261 Win=366592 Len=0
## using the test py , seq is not right. How can put pcap one by one , but still get the seq number right?

python test/test_pcap2shark.py 
packet count 1 seq is 0 
packet count 2 seq is 0 
packet count 3 seq is 1 
packet count 4 seq is 1 
packet count 5 seq is 1 
packet count 6 seq is 1 
packet count 7 seq is 1 
packet count 8 seq is 1 
packet count 9 seq is 1 
packet count 10 seq is 1

**Comment by KimiNewt** [comment]
The inmem class kind of stupidly reopens tshark anew for each packet it sends (which causes some fields that wireshark calculates only for multiple packets/session to not display correctly). This had some justification which I cannot recall back when threading was used, but I think that with asyncio it is possible to keep the process running and feed it packets until the user decides to close it.

I'll try writing that when I have some time.
