### ISSUE TITLE
When InMemCapture() uses the 'only_summaries = True' option, the second time using the parse_packet method raises TimeoutError

### ISSUE THREAD

**Issue by SAMOxtan** [KimiNewt/pyshark#316]
After creating the **InMemCapture(_only_summaries_ = True)**, the second time using the _parse_packet_ method will raise **TimeoutError** and close tshark, it looks like a bug(if I don't use the **_only_summaries_** option, everything will be fine), as follows:
```
cap = pyshark.LiveCapture(interface='WLAN', use_json = True, include_raw = True)
imc = pyshark.InMemCapture(only_summaries = True)
cap.sniff(packet_count=5)

# raw -> bytes
frame_raw_value = cap[0].frame_raw.value
bytes_raw = bytes.fromhex(frame_raw_value)
# bytes -> packet
print(imc.parse_packet(bytes_raw))
```
```
1 0.0 192.168.1.222 192.168.1.233 TCP 62 14124 \xe2\x86\x92 443 [SYN] Seq=0 Win=64240 Len=0 MSS=1460 SACK_PERM=1
```

The second time using the **_parse_packet_** method will raise **TimeoutError** and close tshark
```
print(imc.parse_packet(bytes_raw))
```
```
Traceback (most recent call last):
  File "E:\Python3.6.1\lib\site-packages\pyshark\capture\inmem_capture.py", line 123, in _get_parsed_packet_from_tshark
    DEFAULT_TIMEOUT)
  File "E:\Python3.6.1\lib\asyncio\tasks.py", line 356, in wait_for
    raise futures.TimeoutError()
concurrent.futures._base.TimeoutError

During handling of the above exception, another exception occurred:

Traceback (most recent call last):
  File "<stdin>", line 1, in <module>
  File "E:\Python3.6.1\lib\site-packages\pyshark\capture\inmem_capture.py", line 93, in parse_packet
    return self.parse_packets([binary_packet])[0]
  File "E:\Python3.6.1\lib\site-packages\pyshark\capture\inmem_capture.py", line 116, in parse_packets
    self.eventloop.run_until_complete(self._get_parsed_packet_from_tshark(callback))
  File "E:\Python3.6.1\lib\asyncio\base_events.py", line 466, in run_until_complete
    return future.result()
  File "E:\Python3.6.1\lib\site-packages\pyshark\capture\inmem_capture.py", line 126, in _get_parsed_packet_from_tshark
    raise asyncio.TimeoutError("Timed out while waiting for tshark to parse packet. "
concurrent.futures._base.TimeoutError: Timed out while waiting for tshark to parse packet. Try rerunning with cap.set_debug() to see tshark errors. Closing tshark..
```
\-------------------------------
My current solution:

```
for i in range(3):
    imc = pyshark.InMemCapture(only_summaries = True)
    print(imc.parse_packet(bytes_raw))
```

```
1 0.0 192.168.1.222 192.168.1.233 TCP 62 14124 \xe2\x86\x92 443 [SYN] Seq=0 Win=64240 Len=0 MSS=1460 SACK_PERM=1
1 0.0 192.168.1.222 192.168.1.233 TCP 62 14124 \xe2\x86\x92 443 [SYN] Seq=0 Win=64240 Len=0 MSS=1460 SACK_PERM=1
1 0.0 192.168.1.222 192.168.1.233 TCP 62 14124 \xe2\x86\x92 443 [SYN] Seq=0 Win=64240 Len=0 MSS=1460 SACK_PERM=1
```
